{
  "$schema": "https://json-schema.org/draft/2020-12/schema",
  "title": "CAO Agent Profile Frontmatter",
  "description": "Validates the YAML frontmatter of a CAO agent profile .md file.",
  "type": "object",
  "required": ["name"],
  "properties": {
    "name": {
      "type": "string",
      "pattern": "^[A-Za-z0-9_-]{1,64}$",
      "description": "Unique agent identifier (filesystem-safe)."
    },
    "description": {
      "type": "string",
      "maxLength": 1024,
      "description": "Brief description of the agent's purpose."
    },
    "capabilities": {
      "type": "array",
      "items": {"type": "string", "maxLength": 128},
      "maxItems": 32,
      "description": "Short capability statements used by profile discovery (e.g. 'query dynamodb tables')."
    },
    "tags": {
      "type": "array",
      "items": {"type": "string", "pattern": "^[A-Za-z0-9_-]{1,64}$"},
      "maxItems": 32,
      "description": "Keyword tags used by profile discovery (e.g. 'sqs', 'monitoring')."
    },
    "role": {
      "type": "string",
      "description": "Agent role. Built-in values: supervisor, developer, reviewer, workflow_scout. Custom roles are also supported via settings.json."
    },
    "provider": {
      "type": "string",
      "description": "Provider override (e.g. claude_code, kiro_cli, codex)."
    },
    "engine": {
      "type": "string",
      "enum": ["v2", "v3", "kas"],
      "description": "Kiro engine selection. 'kas' is an alias of 'v3' and is stored as 'v3'."
    },
    "allowedTools": {
      "type": "array",
      "items": {"type": "string"},
      "description": "CAO tool vocabulary allowlist."
    },
    "delegateTools": {
      "type": "array",
      "items": {"type": "string"},
      "description": "Delegation ceiling: the most this agent may grant to workers it creates via assign, handoff or a workflow step (same vocabulary as allowedTools). Defaults to ['*'] for role supervisor and to the agent's own allowedTools otherwise. See docs/tool-restrictions.md."
    },
    "mcpServers": {
      "type": "object",
      "description": "MCP server configurations for additional tools.",
      "additionalProperties": {
        "type": "object",
        "description": "One MCP server. A command-launched server sets 'command'; a remote server sets 'url', with 'type' naming its transport (for example 'http' or 'sse'). At least one of the two is required.",
        "properties": {
          "type": {"type": "string"},
          "command": {"type": "string"},
          "args": {"type": "array", "items": {"type": "string"}},
          "env": {"type": "object", "additionalProperties": {"type": "string"}},
          "timeout": {"type": "integer"},
          "url": {"type": "string"}
        },
        "anyOf": [
          {"required": ["command"]},
          {"required": ["url"]}
        ]
      }
    },
    "tools": {
      "type": "array",
      "items": {"type": "string"}
    },
    "toolAliases": {
      "type": "object",
      "additionalProperties": {"type": "string"}
    },
    "toolsSettings": {
      "type": "object"
    },
    "model": {
      "type": "string"
    },
    "permissionMode": {
      "type": "string",
      "enum": ["default", "acceptEdits", "plan", "auto", "bypassPermissions"]
    },
    "native_agent": {
      "type": "string"
    },
    "codexProfile": {
      "type": "string",
      "minLength": 1
    },
    "codexConfig": {
      "type": "object"
    },
    "claudeConfig": {
      "type": "object"
    },
    "kiroConfig": {
      "type": "object"
    },
    "hermesProfile": {
      "type": "string",
      "minLength": 1
    },
    "kimiSwarm": {
      "type": ["boolean", "null"],
      "description": "Kimi Code only. Override native Swarm startup activation; omission or null inherits the operator default. Requires a vetted executable when enabled and grants no additional tools."
    },
    "kimiSwarmMaxConcurrency": {
      "type": ["integer", "null"],
      "minimum": 1,
      "maximum": 10,
      "description": "Kimi Code only. Concurrent native subagents per batch. Omission or null inherits the managed policy; an explicit limit requires executable verification."
    },
    "grokNativeWorkflows": {
      "type": "boolean",
      "default": false,
      "description": "Grok Build only. Explicitly permits Grok-native subagents, workflows, and /goal in this CAO terminal."
    },
    "skills": {
      "type": "array",
      "items": {"type": "string"}
    },
    "container": {
      "type": "object",
      "description": "CAO-native container settings. Consumed by the provider layer, not passed through to provider JSON.",
      "properties": {
        "path_maps": {
          "type": "array",
          "description": "Host-to-guest path translations for provider files used inside a container. CAO rewrites matching prefixes using the longest match; it does not create the container or its bind mounts.",
          "items": {
            "type": "object",
            "properties": {
              "host": {"type": "string", "minLength": 1},
              "guest": {"type": "string", "minLength": 1}
            },
            "required": ["host", "guest"]
          }
        }
      }
    },
    "provider_init_timeout": {
      "type": "integer",
      "minimum": 1,
      "description": "Per-profile override, in seconds, for provider initialization. Replaces the server-wide provider_init_timeout as the hard outer cap for this profile."
    },
    "prompt": {
      "type": "string"
    },
    "resources": {
      "type": "array",
      "items": {"type": "string"}
    },
    "hooks": {
      "type": "object"
    },
    "useLegacyMcpJson": {
      "type": "boolean"
    },
    "x-cao-source-stem": {
      "type": "string",
      "pattern": "^[A-Za-z0-9_-]{1,64}$",
      "description": "CAO-generated context-copy provenance. Records the original profile source stem."
    }
  },
  "additionalProperties": false
}
